{
  "name": "Volca FM",
  "manufacturer": "Korg",
  "schemaVersion": 1,
  "parameters": [
    {
      "name": "Transpose",
      "type": "cc",
      "number": 40,
      "min": 0,
      "max": 127,
      "enabled": false
    },
    {
      "name": "Velocity",
      "type": "cc",
      "number": 41,
      "min": 0,
      "max": 127,
      "enabled": false
    },
    {
      "name": "Modulator attack",
      "type": "cc",
      "number": 42,
      "min": 0,
      "max": 127,
      "enabled": true
    },
    {
      "name": "Modulator decay",
      "type": "cc",
      "number": 43,
      "min": 0,
      "max": 127,
      "enabled": true
    },
    {
      "name": "Carrier attack",
      "type": "cc",
      "number": 44,
      "min": 0,
      "max": 127,
      "enabled": true
    },
    {
      "name": "Carrier decay",
      "type": "cc",
      "number": 45,
      "min": 0,
      "max": 127,
      "enabled": true
    },
    {
      "name": "LFO rate",
      "type": "cc",
      "number": 46,
      "min": 0,
      "max": 127,
      "enabled": true
    },
    {
      "name": "LFO pitch depth",
      "type": "cc",
      "number": 47,
      "min": 0,
      "max": 127,
      "enabled": true
    },
    {
      "name": "Algorithm",
      "type": "cc",
      "number": 48,
      "min": 0,
      "max": 127,
      "enabled": true
    },
    {
      "name": "Arpeggiator type",
      "type": "cc",
      "number": 49,
      "min": 0,
      "max": 127,
      "enabled": false
    },
    {
      "name": "Arpeggiator div",
      "type": "cc",
      "number": 50,
      "min": 0,
      "max": 127,
      "enabled": false
    }
  ]
}
